{
  "$schema": "https://json-schema.org/draft/2020-12/schema",
  "$id": "https://raw.githubusercontent.com/Maferreira25/Aura-Code/main/schemas/fuzz-suite.schema.json",
  "title": "Aura Code Fuzzing Suite",
  "type": "object",
  "required": [
    "schema_version",
    "suite_id",
    "title",
    "requirements",
    "adapter",
    "target",
    "corpus",
    "seed",
    "iterations",
    "timeout_seconds"
  ],
  "properties": {
    "schema_version": {"type": "string", "const": "1.0.0"},
    "suite_id": {"type": "string", "pattern": "^FUZZ-[A-Z0-9][A-Z0-9._-]*$"},
    "title": {"type": "string", "minLength": 3},
    "requirements": {
      "type": "array",
      "minItems": 1,
      "items": {"type": "string", "minLength": 1},
      "uniqueItems": true
    },
    "adapter": {"enum": ["python-callable"]},
    "target": {
      "type": "string",
      "pattern": "^[A-Za-z_][A-Za-z0-9_.]*:[A-Za-z_][A-Za-z0-9_]*$"
    },
    "corpus": {
      "type": "array",
      "minItems": 1,
      "items": {}
    },
    "seed": {"type": "integer", "minimum": 0},
    "iterations": {"type": "integer", "minimum": 1, "maximum": 10000},
    "timeout_seconds": {"type": "number", "exclusiveMinimum": 0, "maximum": 60}
  },
  "additionalProperties": false
}
